520:211696, ack 321, win 501, length 176
01:21:16.713365 IP 159.89.117.125.22 > 99.225.28.247.49301: Flags [P.], seq 211696:211872, ack 321, win 501, length 176
01:21:16.713468 IP 159.89.117.125.22 > 99.225.28.247.49301: Flags [P.], seq 211872:212048, ack 321, win 501, length 176
01:21:16.713569 IP 159.89.117.125.22 > 99.225.28.247.49301: Flags [P.], seq 212048:212224, ack 321, win 501, length 176
01:21:16.720137 IP 99.225.28.247.49301 > 159.89.117.125.22: Flags [.], ack 208912, win 4117, length 0
01:21:16.720189 IP 159.89.117.125.22 > 99.225.28.247.49301: Flags [P.], seq 212224:212400, ack 321, win 501, length 176
01:21:16.720214 IP 99.225.28.247.49301 > 159.89.117.125.22: Flags [.], ack 210704, win 4117, length 0
01:21:16.720444 IP 159.89.117.125.22 > 99.225.28.247.49301: Flags [P.], seq 212400:212784, ack 321, win 501, length 384
01:21:16.720566 IP 159.89.117.125.22 > 99.225.28.247.49301: Flags [P.], seq 212784:212960, ack 321, win 501, length 176
01:21:16.720673 IP 159.89.117.125.22 > 99.225.28.247.49301: Flags [P.], seq 212960:213136, ack 321, win 501, length 176
01:21:16.720776 IP 159.89.117.125.22 > 99.225.28.247.49301: Flags [P.], seq 213136:213312, ack 321, win 501, length 176
01:21:16.720877 IP 159.89.117.125.22 > 99.225.28.247.49301: Flags [P.], seq 213312:213488, ack 321, win 501, length 176
01:21:16.720980 IP 159.89.117.125.22 > 99.225.28.247.49301: Flags [P.], seq 213488:213664, ack 321, win 501, length 176
01:21:16.721096 IP 159.89.117.125.22 > 99.225.28.247.49301: Flags [P.], seq 213664:213840, ack 321, win 501, length 176
01:21:16.721200 IP 159.89.117.125.22 > 99.225.28.247.49301: Flags [P.], seq 213840:214016, ack 321, win 501, length 176
01:21:16.721336 IP 159.89.117.125.22 > 99.225.28.247.49301: Flags [P.], seq 214016:214192, ack 321, win 501, length 176
01:21:16.721444 IP 159.89.117.125.22 > 99.225.28.247.49301: Flags [P.], seq 214192:214368, ack 321, win 501, length 176
01:21:16.721548 IP 159.89.117.125.22 > 99.225.28.247.49301: Flags [P.], seq 214368:214544, ack 321, win 501, length 176
01:21:16.721704 IP 159.89.117.125.22 > 99.225.28.247.49301: Flags [P.], seq 214544:214720, ack 321, win 501, length 176
01:21:16.721861 IP 159.89.117.125.22 > 99.225.28.247.49301: Flags [P.], seq 214720:214896, ack 321, win 501, length 176
01:21:16.721968 IP 159.89.117.125.22 > 99.225.28.247.49301: Flags [P.], seq 214896:215072, ack 321, win 501, length 176
01:21:16.722088 IP 159.89.117.125.22 > 99.225.28.247.49301: Flags [P.], seq 215072:215248, ack 321, win 501, length 176
01:21:16.722195 IP 159.89.117.125.22 > 99.225.28.247.49301: Flags [P.], seq 215248:215424, ack 321, win 501, length 176
01:21:16.722306 IP 159.89.117.125.22 > 99.225.28.247.49301: Flags [P.], seq 215424:215600, ack 321, win 501, length 176
01:21:16.722410 IP 159.89.117.125.22 > 99.225.28.247.49301: Flags [P.], seq 215600:215776, ack 321, win 501, length 176
01:21:16.722515 IP 159.89.117.125.22 > 99.225.28.247.49301: Flags [P.], seq 215776:215952, ack 321, win 501, length 176
01:21:16.722617 IP 159.89.117.125.22 > 99.225.28.247.49301: Flags [P.], seq 215952:216128, ack 321, win 501, length 176
01:21:16.722753 IP 159.89.117.125.22 > 99.225.28.247.49301: Flags [P.], seq 216128:216304, ack 321, win 501, length 176
01:21:16.722880 IP 159.89.117.125.22 > 99.225.28.247.49301: Flags [P.], seq 216304:216480, ack 321, win 501, length 176
01:21:16.722991 IP 159.89.117.125.22 > 99.225.28.247.49301: Flags [P.], seq 216480:216656, ack 321, win 501, length 176
01:21:16.723105 IP 159.89.117.125.22 > 99.225.28.247.49301: Flags [P.], seq 216656:216832, ack 321, win 501, length 176
01:21:16.729394 IP 99.225.28.247.49301 > 159.89.117.125.22: Flags [.], ack 212224, win 4117, length 0
01:21:16.729434 IP 159.89.117.125.22 > 99.225.28.247.49301: Flags [P.], seq 216832:217008, ack 321, win 501, length 176
01:21:16.729461 IP 99.225.28.247.49301 > 159.89.117.125.22: Flags [.], ack 213488, win 4112, length 0
01:21:16.729677 IP 159.89.117.125.22 > 99.225.28.247.49301: Flags [P.], seq 217008:217392, ack 321, win 501, length 384
01:21:16.729850 IP 159.89.117.125.22 > 99.225.28.247.49301: Flags [P.], seq 217392:217568, ack 321, win 501, length 176
01:21:16.729982 IP 159.89.117.125.22 > 99.225.28.247.49301: Flags [P.], seq 217568:217744, ack 321, win 501, length 176
01:21:16.730113 IP 159.89.117.125.22 > 99.225.28.247.49301: Flags [P.], seq 217744:217920, ack 321, win 501, length 176
01:21:16.730238 IP 159.89.117.125.22 > 99.225.28.247.49301: Flags [P.], seq 217920:218096, ack 321, win 501, length 176
01:21:16.730361 IP 159.89.117.125.22 > 99.225.28.247.49301: Flags [P.], seq 218096:218272, ack 321, win 501, length 176
01:21:16.730483 IP 159.89.117.125.22 > 99.225.28.247.49301: Flags [P.], seq 218272:218448, ack 321, win 501, length 176
01:21:16.730608 IP 159.89.117.125.22 > 99.225.28.247.49301: Flags [P.], seq 218448:218624, ack 321, win 501, length 176
01:21:16.730726 IP 159.89.117.125.22 > 99.225.28.247.49301: Flags [P.], seq 218624:218800, ack 321, win 501, length 176
01:21:16.730852 IP 159.89.117.125.22 > 99.225.28.247.49301: Flags [P.], seq 218800:218976, ack 321, win 501, length 176
01:21:16.730974 IP 159.89.117.125.22 > 99.225.28.247.49301: Flags [P.], seq 218976:219152, ack 321, win 501, length 176
01:21:16.731097 IP 159.89.117.125.22 > 99.225.28.247.49301: Flags [P.], seq 219152:219328, ack 321, win 501, length 176
01:21:16.731228 IP 159.89.117.125.22 > 99.225.28.247.49301: Flags [P.], seq 219328:219504, ack 321, win 501, length 176
01:21:16.737115 IP 99.225.28.247.49301 > 159.89.117.125.22: Flags [.], ack 215424, win 4117, length 0
01:21:16.737160 IP 159.89.117.125.22 > 99.225.28.247.49301: Flags [P.], seq 219504:219680, ack 321, win 501, length 176
01:21:16.737184 IP 99.225.28.247.49301 > 159.89.117.125.22: Flags [.], ack 216832, win 4112, length 0
01:21:16.737198 IP 99.225.28.247.49301 > 159.89.117.125.22: Flags [.], ack 217920, win 4117, length 0
01:21:16.737506 IP 159.89.117.125.22 > 99.225.28.247.49301: Flags [P.], seq 219680:220160, ack 321, win 501, length 480
01:21:16.737704 IP 159.89.117.125.22 > 99.225.28.247.49301: Flags [P.], seq 220160:220336, ack 321, win 501, length 176
01:21:16.737863 IP 159.89.117.125.22 > 99.225.28.247.49301: Flags [P.], seq 220336:220512, ack 321, win 501, length 176
01:21:16.738048 IP 159.89.117.125.22 > 99.225.28.247.49301: Flags [P.], seq 220512:220688, ack 321, win 501, length 176
01:21:16.738162 IP 159.89.117.125.22 > 99.225.28.247.49301: Flags [P.], seq 220688:220864, ack 321, win 501, length 176
01:21:16.738269 IP 159.89.117.125.22 > 99.225.28.247.49301: Flags [P.], seq 220864:221040, ack 321, win 501, length 176
01:21:16.738371 IP 159.89.117.125.22 > 99.225.28.247.49301: Flags [P.], seq 221040:221216, ack 321, win 501, length 176
01:21:16.738473 IP 159.89.117.125.22 > 99.225.28.247.49301: Flags [P.], seq 221216:221392, ack 321, win 501, length 176
01:21:16.738573 IP 159.89.117.125.22 > 99.225.28.247.49301: Flags [P.], seq 221392:221568, ack 321, win 501, length 176
01:21:16.738674 IP 159.89.117.125.22 > 99.225.28.247.49301: Flags [P.], seq 221568:221744, ack 321, win 501, length 176
01:21:16.738776 IP 159.89.117.125.22 > 99.225.28.247.49301: Flags [P.], seq 221744:221920, ack 321, win 501, length 176
01:21:16.738877 IP 159.89.117.125.22 > 99.225.28.247.49301: Flags [P.], seq 221920:222096, ack 321, win 501, length 176
01:21:16.738978 IP 159.89.117.125.22 > 99.225.28.247.49301: Flags [P.], seq 222096:222272, ack 321, win 501, length 176
01:21:16.739079 IP 159.89.117.125.22 > 99.225.28.247.49301: Flags [P.], seq 222272:222448, ack 321, win 501, length 176
01:21:16.739179 IP 159.89.117.125.22 > 99.225.28.247.49301: Flags [P.], seq 222448:222624, ack 321, win 501, length 176
01:21:16.739281 IP 159.89.117.125.22 > 99.225.28.247.49301: Flags [P.], seq 222624:222800, ack 321, win 501, length 176
01:21:16.739382 IP 159.89.117.125.22 > 99.225.28.247.49301: Flags [P.], seq 222800:222976, ack 321, win 501, length 176
01:21:16.739509 IP 159.89.117.125.22 > 99.225.28.247.49301: Flags [P.], seq 222976:223152, ack 321, win 501, length 176
01:21:16.739614 IP 159.89.117.125.22 > 99.225.28.247.49301: Flags [P.], seq 223152:223328, ack 321, win 501, length 176
01:21:16.739716 IP 159.89.117.125.22 > 99.225.28.247.49301: Flags [P.], seq 223328:223504, ack 321, win 501, length 176
01:21:16.739817 IP 159.89.117.125.22 > 99.225.28.247.49301: Flags [P.], seq 223504:223680, ack 321, win 501, length 176
01:21:16.739919 IP 159.89.117.125.22 > 99.225.28.247.49301: Flags [P.], seq 223680:223856, ack 321, win 501, length 176
01:21:16.740021 IP 159.89.117.125.22 > 99.225.28.247.49301: Flags [P.], seq 223856:224032, ack 321, win 501, length 176
01:21:16.740121 IP 159.89.117.125.22 > 99.225.28.247.49301: Flags [P.], seq 224032:224208, ack 321, win 501, length 176
01:21:16.743722 IP 99.225.28.247.49301 > 159.89.117.125.22: Flags [.], ack 219504, win 4117, length 0
01:21:16.743766 IP 159.89.117.125.22 > 99.225.28.247.49301: Flags [P.], seq 224208:224384, ack 321, win 501, length 176
01:21:16.743962 IP 159.89.117.125.22 > 99.225.28.247.49301: Flags [P.], seq 224384:224672, ack 321, win 501, length 288
01:21:16.744083 IP 159.89.117.125.22 > 99.225.28.247.49301: Flags [P.], seq 224672:224848, ack 321, win 501, length 176
01:21:16.744194 IP 159.89.117.125.22 > 99.225.28.247.49301: Flags [P.], seq 224848:225024, ack 321, win 501, length 176
01:21:16.744301 IP 159.89.117.125.22 > 99.225.28.247.49301: Flags [P.], seq 225024:225200, ack 321, win 501, length 176
01:21:16.744405 IP 159.89.117.125.22 > 99.225.28.247.49301: Flags [P.], seq 225200:225376, ack 321, win 501, length 176
01:21:16.744509 IP 159.89.117.125.22 > 99.225.28.247.49301: Flags [P.], seq 225376:225552, ack 321, win 501, length 176
01:21:16.744612 IP 159.89.117.125.22 > 99.225.28.247.49301: Flags [P.], seq 225552:225728, ack 321, win 501, length 176
01:21:16.744719 IP 159.89.117.125.22 > 99.225.28.247.49301: Flags [P.], seq 225728:225904, ack 321, win 501, length 176
01:21:16.751532 IP 99.225.28.247.49301 > 159.89.117.125.22: Flags [.], ack 221216, win 4117, length 0
01:21:16.751562 IP 159.89.117.125.22 > 99.225.28.247.49301: Flags [P.], seq 225904:226080, ack 321, win 501, length 176
01:21:16.751687 IP 159.89.117.125.22 > 99.225.28.247.49301: Flags [P.], seq 226080:226368, ack 321, win 501, length 288
01:21:16.751762 IP 159.89.117.125.22 > 99.225.28.247.49301: Flags [P.], seq 226368:226544, ack 321, win 501, length 176
01:21:16.751830 IP 159.89.117.125.22 > 99.225.28.247.49301: Flags [P.], seq 226544:226720, ack 321, win 501, length 176
01:21:16.751896 IP 159.89.117.125.22 > 99.225.28.247.49301: Flags [P.], seq 226720:226896, ack 321, win 501, length 176
01:21:16.751960 IP 159.89.117.125.22 > 99.225.28.247.49301: Flags [P.], seq 226896:227072, ack 321, win 501, length 176
01:21:16.752068 IP 159.89.117.125.22 > 99.225.28.247.49301: Flags [P.], seq 227072:227248, ack 321, win 501, length 176
01:21:16.752155 IP 159.89.117.125.22 > 99.225.28.247.49301: Flags [P.], seq 227248:227424, ack 321, win 501, length 176
01:21:16.752223 IP 159.89.117.125.22 > 99.225.28.247.49301: Flags [P.], seq 227424:227600, ack 321, win 501, length 176
01:21:16.758978 IP 99.225.28.247.49301 > 159.89.117.125.22: Flags [.], ack 223504, win 4117, length 0
01:21:16.759026 IP 159.89.117.125.22 > 99.225.28.247.49301: Flags [P.], seq 227600:227776, ack 321, win 501, length 176
01:21:16.759050 IP 99.225.28.247.49301 > 159.89.117.125.22: Flags [.], ack 224208, win 4114, length 0
01:21:16.759061 IP 99.225.28.247.49301 > 159.89.117.125.22: Flags [P.], seq 321:385, ack 224208, win 4114, length 64
^C
1349 packets captured
1349 packets received by filter
0 packets dropped by kernel
